{
  "$schema": "http://json-schema.org/draft-07/schema#",
  "type": "object",
  "properties": {
    "schemaVersion": {
      "type": "number",
      "const": 1
    },
    "id": {
      "type": "string",
      "format": "uuid",
      "pattern": "^([0-9a-fA-F]{8}-[0-9a-fA-F]{4}-[1-8][0-9a-fA-F]{3}-[89abAB][0-9a-fA-F]{3}-[0-9a-fA-F]{12}|00000000-0000-0000-0000-000000000000|ffffffff-ffff-ffff-ffff-ffffffffffff)$"
    },
    "workUnitId": {
      "type": "string",
      "format": "uuid",
      "pattern": "^([0-9a-fA-F]{8}-[0-9a-fA-F]{4}-[1-8][0-9a-fA-F]{3}-[89abAB][0-9a-fA-F]{3}-[0-9a-fA-F]{12}|00000000-0000-0000-0000-000000000000|ffffffff-ffff-ffff-ffff-ffffffffffff)$"
    },
    "requirementIds": {
      "type": "array",
      "items": {
        "type": "string",
        "format": "uuid",
        "pattern": "^([0-9a-fA-F]{8}-[0-9a-fA-F]{4}-[1-8][0-9a-fA-F]{3}-[89abAB][0-9a-fA-F]{3}-[0-9a-fA-F]{12}|00000000-0000-0000-0000-000000000000|ffffffff-ffff-ffff-ffff-ffffffffffff)$"
      }
    },
    "objective": {
      "type": "string",
      "minLength": 1
    },
    "nonGoals": {
      "type": "array",
      "items": {
        "type": "string",
        "minLength": 1
      }
    },
    "baseObjectId": {
      "type": "string",
      "minLength": 1
    },
    "relevantInterfaces": {
      "type": "array",
      "items": {
        "type": "string",
        "minLength": 1
      }
    },
    "ownedPaths": {
      "type": "array",
      "items": {
        "type": "string",
        "minLength": 1
      }
    },
    "constraints": {
      "type": "array",
      "items": {
        "type": "string",
        "minLength": 1
      }
    },
    "resourceLimits": {
      "type": "object",
      "properties": {
        "maxTurns": {
          "type": "integer",
          "exclusiveMinimum": 0,
          "maximum": 9007199254740991
        },
        "maxBudgetUsd": {
          "type": "number",
          "minimum": 0
        }
      },
      "required": [
        "maxTurns"
      ],
      "additionalProperties": false
    },
    "gates": {
      "type": "array",
      "items": {
        "type": "string",
        "minLength": 1
      }
    },
    "resultSchema": {
      "type": "object",
      "propertyNames": {
        "type": "string"
      },
      "additionalProperties": {}
    }
  },
  "required": [
    "schemaVersion",
    "id",
    "workUnitId",
    "requirementIds",
    "objective",
    "nonGoals",
    "baseObjectId",
    "relevantInterfaces",
    "ownedPaths",
    "constraints",
    "resourceLimits",
    "gates",
    "resultSchema"
  ],
  "additionalProperties": false
}
